{
  "$schema": "http://json-schema.org/draft-07/schema#",
  "$id": "urn:nansen:schema:task",
  "title": "NANSEN task",
  "description": "One queued or finished run of a method, in tasks/<id>.task.nansen.json. Entities are referenced by type and key, never as live objects, so any worker (thread, process, MATLAB or Python) rebuilds them from the project folder, and a task file survives changes to the code. While a task runs, its worker owns the file; a cancel request is a tasks/<id>.cancel file the worker checks.",
  "type": "object",
  "required": [
    "schemaType",
    "schemaVersion",
    "id",
    "method",
    "entities",
    "options",
    "status",
    "createdAt"
  ],
  "additionalProperties": false,
  "properties": {
    "$schema": {
      "type": "string"
    },
    "schemaType": {
      "const": "nansen.task"
    },
    "schemaVersion": {
      "type": "string",
      "pattern": "^0\\.1\\.\\d+$"
    },
    "id": {
      "type": "string",
      "pattern": "^[0-9a-f]{8}-[0-9a-f]{4}-[0-9a-f]{4}-[0-9a-f]{4}-[0-9a-f]{12}$"
    },
    "method": {
      "$ref": "#/definitions/methodRef"
    },
    "entities": {
      "type": "array",
      "minItems": 1,
      "items": {
        "$ref": "#/definitions/entityRef"
      }
    },
    "options": {
      "type": "object",
      "required": [
        "values"
      ],
      "additionalProperties": false,
      "properties": {
        "preset": {
          "type": "string",
          "description": "Name of the preset the values started from, if any."
        },
        "values": {
          "type": "object"
        }
      }
    },
    "status": {
      "type": "string",
      "enum": [
        "queued",
        "running",
        "completed",
        "failed",
        "cancelled"
      ]
    },
    "createdAt": {
      "type": "string",
      "pattern": "^\\d{4}-\\d{2}-\\d{2}T\\d{2}:\\d{2}:\\d{2}(\\.\\d{3})?$"
    },
    "startedAt": {
      "type": "string",
      "pattern": "^\\d{4}-\\d{2}-\\d{2}T\\d{2}:\\d{2}:\\d{2}(\\.\\d{3})?$"
    },
    "finishedAt": {
      "type": "string",
      "pattern": "^\\d{4}-\\d{2}-\\d{2}T\\d{2}:\\d{2}:\\d{2}(\\.\\d{3})?$"
    },
    "log": {
      "type": "string",
      "description": "Path of the captured log, relative to the project folder."
    },
    "error": {
      "type": "object",
      "required": [
        "message"
      ],
      "additionalProperties": false,
      "properties": {
        "identifier": {
          "type": "string"
        },
        "message": {
          "type": "string"
        },
        "stack": {
          "type": "array",
          "items": {
            "type": "string"
          }
        }
      }
    },
    "progress": {
      "type": "number",
      "minimum": 0,
      "maximum": 1,
      "description": "Fraction done, as last reported by the method."
    },
    "message": {
      "type": "string",
      "description": "The last progress message."
    },
    "language": {
      "type": "string",
      "enum": [
        "matlab",
        "python"
      ],
      "description": "The language that should run the task; any worker that can run the method may take it when absent."
    },
    "order": {
      "type": "integer",
      "minimum": 0,
      "description": "Place in the queue, set when queued tasks are reordered: tasks with an order run first, lowest first; the others follow by creation time."
    },
    "onHold": {
      "type": "boolean",
      "description": "A queued task on hold is not started until it is released; it keeps its place."
    },
    "result": {
      "description": "What the method returned, when it is JSON and small; one item per entity for a serial method."
    },
    "skipCompleted": {
      "type": "boolean",
      "description": "Leave out, when the task runs, the entities the method already completed on (the run journal) whose outputs are there (dev's RedoIfCompleted off)."
    },
    "skipped": {
      "type": "array",
      "items": {
        "type": "object",
        "additionalProperties": {
          "type": [
            "string",
            "integer"
          ]
        }
      },
      "description": "Keys of the entities left out by skipCompleted, set when the task ran."
    },
    "after": {
      "type": "array",
      "uniqueItems": true,
      "items": {
        "type": "string"
      },
      "description": "Tasks that must complete before this one runs. If one of them fails or is cancelled, this task is cancelled."
    },
    "pipeline": {
      "type": "object",
      "required": [
        "id",
        "step",
        "steps"
      ],
      "additionalProperties": false,
      "description": "Set when the task is a step of a pipeline run.",
      "properties": {
        "id": {
          "type": "string"
        },
        "run": {
          "type": "string",
          "description": "Id shared by the tasks of one pipeline run on one entity."
        },
        "step": {
          "type": "integer",
          "description": "0-based index of the step."
        },
        "steps": {
          "type": "integer"
        },
        "title": {
          "type": "string"
        }
      }
    },
    "comment": {
      "type": "string",
      "description": "A note on the task, as dev's task manager's Comment column: written in the queue or the history."
    }
  },
  "definitions": {
    "methodRef": {
      "type": "object",
      "required": [
        "id",
        "version"
      ],
      "additionalProperties": false,
      "properties": {
        "id": {
          "type": "string"
        },
        "version": {
          "type": "string",
          "pattern": "^\\d+\\.\\d+\\.\\d+$"
        }
      }
    },
    "entityRef": {
      "type": "object",
      "required": [
        "entityType",
        "key"
      ],
      "additionalProperties": false,
      "properties": {
        "entityType": {
          "type": "string",
          "pattern": "^[A-Za-z][A-Za-z0-9_]*$"
        },
        "key": {
          "type": "object",
          "minProperties": 1,
          "description": "Values of the entity table's key columns.",
          "additionalProperties": {
            "type": [
              "string",
              "integer"
            ]
          }
        }
      }
    }
  }
}
